{
  "protocol_version": "agent-metrics/v1",
  "schema": "token-usage/v1",
  "upsert_key": "am1_9089cf56a8f1235aefcc60eaedcad882eb74fba3bf9ddc2036f4cc905ca361a1",
  "emitter": {
    "name": "spec-lane",
    "version": "0.2.0"
  },
  "subject": {
    "namespace": "spec-lane",
    "type": "delivery-run",
    "id": "intent-2026-0503-report-export"
  },
  "repository": {
    "provider": "github",
    "id": "octo-org/spec-lane-demo"
  },
  "change": {
    "type": "pull_request",
    "number": 91,
    "url": "https://github.com/octo-org/spec-lane-demo/pull/91",
    "head_sha": "f60718293a4b5c6d7e8f90123456789ab0c1d2e3"
  },
  "generated_at": "2026-08-11T20:00:00Z",
  "data": {
    "mode": "snapshot",
    "records": [
      {
        "activity": {
          "namespace": "spec-lane",
          "name": "2_spec"
        },
        "agent": "claude",
        "model": "claude-sonnet-5",
        "token_kind": "output",
        "tokens": 300,
        "priced_tokens": 300,
        "unpriced_tokens": 0,
        "estimated_cost_usd": 0.0045,
        "credits": 0,
        "pricing_status": "priced"
      }
    ],
    "coverage": {
      "status": "complete",
      "eligible_entries": 1,
      "measured_entries": 1,
      "excluded_entries": 0,
      "omissions": []
    }
  }
}
