{
  "protocol_version": "agent-metrics/v1",
  "schema": "token-usage/v1",
  "upsert_key": "am1_643d47ac65942de1313862a53603837f6c7c303e41945db129a660bdb2e7de94",
  "emitter": {
    "name": "spec-lane",
    "version": "0.2.0"
  },
  "subject": {
    "namespace": "spec-lane",
    "type": "delivery-run",
    "id": "intent-2026-0417-telemetry-export"
  },
  "repository": {
    "provider": "github",
    "id": "octo-org/spec-lane-demo"
  },
  "change": {
    "type": "pull_request",
    "number": 42,
    "url": "https://github.com/octo-org/spec-lane-demo/pull/42",
    "head_sha": "a1b2c3d4e5f60718293a4b5c6d7e8f9012345678"
  },
  "generated_at": "2026-08-07T00:00:00Z",
  "data": {
    "mode": "snapshot",
    "records": [
      {
        "activity": {
          "namespace": "spec-lane",
          "name": "3_implement"
        },
        "agent": "claude",
        "model": "claude-sonnet-5",
        "token_kind": "cache_write_5m",
        "tokens": 100,
        "priced_tokens": 100,
        "unpriced_tokens": 0,
        "estimated_cost_usd": 0.0003,
        "credits": 0,
        "pricing_status": "priced"
      }
    ],
    "coverage": {
      "status": "complete",
      "eligible_entries": 1,
      "measured_entries": 1,
      "excluded_entries": 0,
      "omissions": []
    }
  }
}
