{
  "protocol_version": "agent-metrics/v1",
  "schema": "token-usage/v1",
  "upsert_key": "am1_2f3b1aaa048084f1a81ee32c9adbc03bf54cb488ab83ef7ae59b0d45eaec9e5b",
  "emitter": {
    "name": "spec-lane",
    "version": "0.2.0"
  },
  "subject": {
    "namespace": "spec-lane",
    "type": "delivery-run",
    "id": "intent-2026-0420-multi-agent-run"
  },
  "repository": {
    "provider": "github",
    "id": "octo-org/spec-lane-demo"
  },
  "change": {
    "type": "pull_request",
    "number": 43,
    "url": "https://github.com/octo-org/spec-lane-demo/pull/43",
    "head_sha": "b2c3d4e5f60718293a4b5c6d7e8f90123456789a"
  },
  "generated_at": "2026-08-07T01:15:00Z",
  "data": {
    "mode": "snapshot",
    "records": [
      {
        "activity": {
          "namespace": "spec-lane",
          "name": "2_spec"
        },
        "agent": "claude",
        "model": "claude-sonnet-5",
        "token_kind": "input_nocache",
        "tokens": 2500,
        "priced_tokens": 2500,
        "unpriced_tokens": 0,
        "estimated_cost_usd": 0.0075,
        "credits": 0,
        "pricing_status": "priced"
      },
      {
        "activity": {
          "namespace": "spec-lane",
          "name": "2_spec"
        },
        "agent": "claude",
        "model": "claude-sonnet-5",
        "token_kind": "output",
        "tokens": 600,
        "priced_tokens": 600,
        "unpriced_tokens": 0,
        "estimated_cost_usd": 0.009,
        "credits": 0,
        "pricing_status": "priced"
      },
      {
        "activity": {
          "namespace": "spec-lane",
          "name": "3_implement"
        },
        "agent": "codex",
        "model": "gpt-5.6-terra",
        "token_kind": "cache_read",
        "tokens": 12000,
        "priced_tokens": 12000,
        "unpriced_tokens": 0,
        "estimated_cost_usd": 0.0036,
        "credits": 0,
        "pricing_status": "priced"
      },
      {
        "activity": {
          "namespace": "spec-lane",
          "name": "3_implement"
        },
        "agent": "codex",
        "model": "gpt-5.6-terra",
        "token_kind": "cache_write_1h",
        "tokens": 800,
        "priced_tokens": 0,
        "unpriced_tokens": 800,
        "estimated_cost_usd": 0,
        "credits": 0,
        "pricing_status": "unpriced"
      }
    ],
    "coverage": {
      "status": "partial",
      "eligible_entries": 5,
      "measured_entries": 4,
      "excluded_entries": 1,
      "omissions": [
        {
          "entry_id": "run-4_verify",
          "reason": "no_session_ids",
          "detail": "verify phase entry carried no session_ids to attribute a breakdown to"
        }
      ]
    }
  }
}
