{
  "protocol_version": "agent-metrics/v1",
  "schema": "token-usage/v1",
  "upsert_key": "am1_c2e70f19bccc6e514c1a80f04e6a6365f1190f0d4cfbf7aa184877833722fa8c",
  "emitter": {
    "name": "pr-review-tool",
    "version": "1.4.0"
  },
  "subject": {
    "namespace": "pr-review-tool",
    "type": "review-run",
    "id": "run-2026-0417-001"
  },
  "repository": {
    "provider": "github",
    "id": "octo-org/pr-review-tool-demo"
  },
  "change": {
    "type": "pull_request",
    "number": 7,
    "url": "https://github.com/octo-org/pr-review-tool-demo/pull/7",
    "head_sha": "c3d4e5f60718293a4b5c6d7e8f90123456789ab0"
  },
  "generated_at": "2026-08-07T02:00:00Z",
  "data": {
    "mode": "snapshot",
    "records": [],
    "coverage": {
      "status": "no_data",
      "eligible_entries": 3,
      "measured_entries": 0,
      "excluded_entries": 3,
      "omissions": [
        {
          "entry_id": "run-2026-0417-001#a",
          "reason": "manual_source_no_breakdown",
          "detail": "manual-source entry carries no session_ids"
        },
        {
          "entry_id": "run-2026-0417-001#b",
          "reason": "manual_source_no_breakdown",
          "detail": "manual-source entry carries no session_ids"
        },
        {
          "entry_id": "run-2026-0417-001#c",
          "reason": "agent_cost_no_matching_rows",
          "detail": "usage CLI returned no rows for the recorded session_ids"
        }
      ]
    }
  }
}
